{
  "protocol_version": 1,
  "resource": "game:unciv:unciv-ab-domination-001",
  "resource_slug": "game-unciv-unciv-ab-domination-001--db6c7598d0",
  "lease_id": "a-host-setup-20260928-012120",
  "owner_agent_id": "gpt-sol-20260928-20b817",
  "acquired_at": "2026-09-28T01:21:20Z",
  "expires_at": "2026-09-28T01:36:20Z",
  "generation": 1,
  "purpose": "Create and validate the real Rome-vs-Mongolia Domination multiplayer game."
}
